{
  "$schema": "schemas/registry-signature.schema.json",
  "schemaVersion": 1,
  "algorithm": "ed25519",
  "keyId": "cert_8c8eb350d5aa84e85357fe811c13a61e",
  "value": "trq1D/ziFLdwulWbj23d6y5cEBBk0p0FhEO5szv0k7J66u68YJiS6o9O2\u002BKkhT7R1RJ35sK0uHPwbU8SAFvoAA==",
  "signedAt": "2026-10-24T16:07:50.9807797+00:00"
}
